{
  "schemaVersion": 2,
  "eventId": "0299488e-2b44-7d5b-8c5b-f594e3a3191b",
  "eventType": "scan.observed",
  "correlationId": "0299488e-2b44-7d5b-8c5b-f594e3a3191b",
  "tenantId": "11111111-1111-4111-8111-111111111111",
  "plantId": "22222222-2222-4222-8222-222222222222",
  "stationId": "33333333-3333-4333-8333-333333333333",
  "sourceId": "77777777-7777-4777-8777-777777777777",
  "observedAtUtc": "2026-09-20T12:00:00.000Z",
  "gatewayAcceptedAtUtc": "2026-09-20T12:00:00.025Z",
  "identifier": {
    "technology": "barcode",
    "value": "SIMULATED-BARCODE-V2-000001"
  }
}
