{
  "schemaVersion": 2,
  "eventId": "0299488e-7d9d-7390-89f5-d4ec9e4b056c",
  "eventType": "scan.observed",
  "correlationId": "0299488e-7d9d-7390-89f5-d4ec9e4b056c",
  "tenantId": "11111111-1111-4111-8111-111111111111",
  "plantId": "22222222-2222-4222-8222-222222222222",
  "stationId": "33333333-3333-4333-8333-333333333333",
  "sourceId": "88888888-8888-4888-8888-888888888888",
  "observedAtUtc": "2026-09-20T12:01:00.000Z",
  "gatewayAcceptedAtUtc": "2026-09-20T12:01:00.041Z",
  "identifier": {
    "technology": "rfid",
    "value": "SIMULATED-EPC-V2-000001"
  }
}
